{"extensions":{},"entries":{
  "\ud800\udc00":{"oid":"record:sg-oid-v1:sha256:e4605ecf2cc5fb0e0cab0fd1e6b2cd06b16bc65795efed5ad1001f8d0fa6e890","entry_kind":"record"},
  "\ue000":{"entry_kind":"record","oid":"record:sg-oid-v1:sha256:b01a3d24cc51d93f60f4325896781e6fd371cd9c5518fdf3e5a416ba06fa74d7"},
  "10":{"oid":"record:sg-oid-v1:sha256:30d1365a55320e55de638075b50ac3abae58397a03b35d8102f10d379789bc00","entry_kind":"record"},
  "2":{"entry_kind":"record","oid":"record:sg-oid-v1:sha256:5dd39e82254efafd6e3cdfbbab48fe06308ed7b59bc45af2531def0eaa0e79a4"}},
 "schema_version":"0.1.0","object_type":"tree"}
